{
  "id": "psychiatrist-legal",
  "status": "example",
  "displayName": "Psychiatrist — legal / Bituach Leumi opinions",
  "displayNameHe": "פסיכיאטר — חוות דעת משפטיות / ביטוח לאומי",
  "vertical": "clinical-legal",
  "what": "כתיבת חוות דעת לוועדות וביטוח לאומי",
  "where": "(למלא בהפעלה)",
  "locale": "he-IL",
  "language": "he",
  "timezone": "Asia/Jerusalem",
  "pipeline": {
    "stages": [
      { "id": "lead", "label": "פנייה", "packHints": ["vfconvert"] },
      { "id": "talk", "label": "איסוף חומר", "packHints": ["vfconvert", "vfsales"] },
      { "id": "offer", "label": "היקף", "packHints": ["vfsales", "vfcopy", "vfcost"] },
      { "id": "fulfill", "label": "כתיבה", "packHints": ["vfprod", "vlicense"] },
      { "id": "close", "label": "מסירה", "packHints": ["vfsales", "vfbooks"] }
    ]
  },
  "fulfillment": {
    "mode": "document",
    "nationalShipping": false,
    "notes": "מסירת מסמך מאובטחת. לא איסוף פיזי כברירת מחדל."
  },
  "production": {
    "kind": "document",
    "notes": "fulfill = טיוטת חוות דעת + מסירה. אין הדפסת מוצר."
  },
  "channels": {
    "instagram": []
  },
  "cta": {
    "primary": "יצירת קשר במייל/וואטסאפ משרדי (למלא בהפעלה)",
    "whatsapp": "חסר",
    "forbidden": ["שלחו DM", "ייעוץ רפואי בצ׳אט", "אבחנה מ־HQ"]
  },
  "close": "human handoff + secure document delivery",
  "compliance": {
    "noInventedPrices": true,
    "noInventedInsights": true,
    "noAutoDm": true,
    "noBoostWithoutLead": true,
    "hqSendViaTools": true,
    "denyPersonalMedicalLegalFoldersUnlessNamed": true,
    "contentAllowed": "educational / process-only marketing; never patient details",
    "extraLocks": [
      "no-patient-phi-in-git",
      "no-clinical-advice-from-hq",
      "drive-medical-legal-only-if-named",
      "quiet-or-no-instagram"
    ]
  },
  "seats": [
    { "id": "lead", "he": "ראש צוות", "roleNote": "היקף · סכום · סיכון" },
    { "id": "studio", "he": "סטודיו", "roleNote": "קליטה · טיוטות פנייה" },
    { "id": "growth", "he": "צמיחה", "roleNote": "תוכן חינוכי זהיר או כבוי" },
    { "id": "ops", "he": "תפעול", "roleNote": "חשבוניות · מעקב מסירה" },
    { "id": "production", "he": "ייצור", "roleNote": "כתיבת חוות דעת · גרסאות" }
  ],
  "locks": [
    "example-only",
    "phi-out-of-git",
    "activate-only-with-lead-seat"
  ],
  "packPrefix": "vf",
  "notes": "DRAFT. Tests document fulfill + clinical-legal compliance. Empty IG list is valid."
}
